{"schema":"contraste.manifest/v1","case_id":"C12","title":{"en":"How large is the counterparty exposure of a swap book, and what CVA does it imply?","es":"¿Qué tan grande es la exposición a la contraparte de un libro de swaps y qué CVA implica?"},"category":{"en":"Market and counterparty risk","es":"Riesgo de mercado y de contraparte"},"question":{"en":"How large is the counterparty exposure of a swap book, what CVA does it imply, and would the simulated exposures have held against the curves later realised?","es":"¿Qué tan grande es la exposición a la contraparte de un libro de swaps, qué CVA implica y habrían resistido las exposiciones simuladas frente a las curvas realizadas después?"},"sources":["treasury-par-curve","treasury-hqm"],"source_details":{"treasury-par-curve":{"name":"US Treasury daily par yield curve","publisher":"U.S. Department of the Treasury","landing":"https://home.treasury.gov/resource-center/data-chart-center/interest-rates/","licence":"no licence sentence found; 17 U.S.C. 105 (page statement UNVERIFIED)","class":"mirror-allowed","attribution":"U.S. Department of the Treasury, Daily Treasury Par Yield Curve Rates"},"treasury-hqm":{"name":"US Treasury High Quality Market (HQM) corporate bond yield curve, end-of-month spot rates","publisher":"U.S. Department of the Treasury","landing":"https://home.treasury.gov/data/treasury-coupon-issues-and-corporate-bond-yield-curve/corporate-bond-yield-curve","licence":"no licence sentence found on home.treasury.gov; FRED tags the series Public Domain: Citation Requested (the Treasury-side sentence is UNVERIFIED)","class":"mirror-allowed","attribution":"U.S. Department of the Treasury, High Quality Market (HQM) Corporate Bond Yield Curve"}},"seed":42,"engine":{"pipeline":"0.12.000","riskvalidation":"0.7.0+25e9538"},"default_variant":"netting-set","artifacts":[{"role":"models","variant_id":"models-hw1f-treasury-2000-2025","truth_status":"synthetic-calibrated","title":{"en":"Calibrations of the Hull-White model, 2000 to 2025","es":"Calibraciones del modelo Hull-White, 2000 a 2025"},"short_title":{"en":"Models","es":"Modelos"},"regime":{"en":"US Treasury curves read up to the date, a synthetic USD swap book, ORE and QuantLib as references.","es":"Curvas del Tesoro de EE. UU. leidas hasta la fecha, un libro sintetico de swaps en USD, ORE y QuantLib como referencias."},"path":"C12/models-hw1f-treasury-2000-2025.json","bytes":165193,"lane":"precompute","gate":{"lane":"precompute","pure_python":false,"wheels":["numpy","riskvalidation","scipy"],"trace_bytes":165193,"run_ms_budget":1500.0,"trace_bytes_budget":262144,"reasons":["not pure-python","runtime exceeds the 1500ms budget"]}},{"role":"variant","variant_id":"single-swap","truth_status":"synthetic-calibrated","title":{"en":"Single swap","es":"Un swap"},"short_title":{"en":"Single swap","es":"Un swap"},"regime":{"en":"US Treasury curves read up to the date, a synthetic USD swap book, ORE and QuantLib as references.","es":"Curvas del Tesoro de EE. UU. leidas hasta la fecha, un libro sintetico de swaps en USD, ORE y QuantLib como referencias."},"models_ref":"C12/models-hw1f-treasury-2000-2025.json","path":"C12/single-swap.json","bytes":262999,"lane":"precompute","gate":{"lane":"precompute","pure_python":false,"wheels":["numpy","riskvalidation","scipy"],"trace_bytes":262999,"run_ms_budget":1500.0,"trace_bytes_budget":262144,"reasons":["not pure-python","runtime exceeds the 1500ms budget","trace_bytes 262999 > 262144"]}},{"role":"variant","variant_id":"netting-set","truth_status":"synthetic-calibrated","title":{"en":"Netting set","es":"Conjunto de neteo"},"short_title":{"en":"Netting set","es":"Conjunto de neteo"},"regime":{"en":"US Treasury curves read up to the date, a synthetic USD swap book, ORE and QuantLib as references.","es":"Curvas del Tesoro de EE. UU. leidas hasta la fecha, un libro sintetico de swaps en USD, ORE y QuantLib como referencias."},"models_ref":"C12/models-hw1f-treasury-2000-2025.json","path":"C12/netting-set.json","bytes":266917,"lane":"precompute","gate":{"lane":"precompute","pure_python":false,"wheels":["numpy","riskvalidation","scipy"],"trace_bytes":266917,"run_ms_budget":1500.0,"trace_bytes_budget":262144,"reasons":["not pure-python","runtime exceeds the 1500ms budget","trace_bytes 266917 > 262144"]}},{"role":"variant","variant_id":"csa-mpor-10d","truth_status":"synthetic-calibrated","title":{"en":"CSA, MPoR 10 days","es":"CSA, MPoR 10 dias"},"short_title":{"en":"CSA, MPoR 10 days","es":"CSA, MPoR 10 dias"},"regime":{"en":"US Treasury curves read up to the date, a synthetic USD swap book, ORE and QuantLib as references.","es":"Curvas del Tesoro de EE. UU. leidas hasta la fecha, un libro sintetico de swaps en USD, ORE y QuantLib como referencias."},"models_ref":"C12/models-hw1f-treasury-2000-2025.json","path":"C12/csa-mpor-10d.json","bytes":274308,"lane":"precompute","gate":{"lane":"precompute","pure_python":false,"wheels":["numpy","riskvalidation","scipy"],"trace_bytes":274308,"run_ms_budget":1500.0,"trace_bytes_budget":262144,"reasons":["not pure-python","runtime exceeds the 1500ms budget","trace_bytes 274308 > 262144"]}},{"role":"variant","variant_id":"csa-mpor-20d","truth_status":"synthetic-calibrated","title":{"en":"CSA, MPoR 20 days","es":"CSA, MPoR 20 dias"},"short_title":{"en":"CSA, MPoR 20 days","es":"CSA, MPoR 20 dias"},"regime":{"en":"US Treasury curves read up to the date, a synthetic USD swap book, ORE and QuantLib as references.","es":"Curvas del Tesoro de EE. UU. leidas hasta la fecha, un libro sintetico de swaps en USD, ORE y QuantLib como referencias."},"models_ref":"C12/models-hw1f-treasury-2000-2025.json","path":"C12/csa-mpor-20d.json","bytes":274538,"lane":"precompute","gate":{"lane":"precompute","pure_python":false,"wheels":["numpy","riskvalidation","scipy"],"trace_bytes":274538,"run_ms_budget":1500.0,"trace_bytes_budget":262144,"reasons":["not pure-python","runtime exceeds the 1500ms budget","trace_bytes 274538 > 262144"]}},{"role":"variant","variant_id":"with-im","truth_status":"synthetic-calibrated","title":{"en":"With initial margin","es":"Con margen inicial"},"short_title":{"en":"With initial margin","es":"Con margen inicial"},"regime":{"en":"US Treasury curves read up to the date, a synthetic USD swap book, ORE and QuantLib as references.","es":"Curvas del Tesoro de EE. UU. leidas hasta la fecha, un libro sintetico de swaps en USD, ORE y QuantLib como referencias."},"models_ref":"C12/models-hw1f-treasury-2000-2025.json","path":"C12/with-im.json","bytes":277571,"lane":"precompute","gate":{"lane":"precompute","pure_python":false,"wheels":["numpy","riskvalidation","scipy"],"trace_bytes":277571,"run_ms_budget":1500.0,"trace_bytes_budget":262144,"reasons":["not pure-python","runtime exceeds the 1500ms budget","trace_bytes 277571 > 262144"]}},{"role":"variant","variant_id":"wrong-way-risk","truth_status":"synthetic-calibrated","title":{"en":"Wrong-way risk","es":"Riesgo de direccion equivocada"},"short_title":{"en":"Wrong-way risk","es":"Riesgo de direccion equivocada"},"regime":{"en":"US Treasury curves read up to the date, a synthetic USD swap book, ORE and QuantLib as references.","es":"Curvas del Tesoro de EE. UU. leidas hasta la fecha, un libro sintetico de swaps en USD, ORE y QuantLib como referencias."},"models_ref":"C12/models-hw1f-treasury-2000-2025.json","path":"C12/wrong-way-risk.json","bytes":258406,"lane":"precompute","gate":{"lane":"precompute","pure_python":false,"wheels":["numpy","riskvalidation","scipy"],"trace_bytes":258406,"run_ms_budget":1500.0,"trace_bytes_budget":262144,"reasons":["not pure-python","runtime exceeds the 1500ms budget"]}}],"contract":{"treasury-par-curve":{"family":"curve","counts":{"input":13,"accepted":13,"rejected":0,"flagged":0,"excluded":0},"by_rule":{"rejected":{},"flagged":{},"excluded":{}},"ignored_columns":[],"examples":[]}},"expect":{"ba_cva_capital_netting_set_usd":[1000.0,5000000.0],"csa_10d_over_netting_eepe":[0.05,1.0],"cva_netting_set_usd":[0.0,50000.0],"eepe_netting_set_usd":[1000.0,500000.0],"sa_ccr_ead_netting_set_usd":[50000.0,5000000.0]}}