{"schema":"contraste.manifest/v1","case_id":"C14","title":{"en":"IRRBB, six shocks on a USD balance sheet: the bank that failed in 2023","es":"IRRBB, seis choques sobre un balance en USD: el banco que quebró en 2023"},"category":{"en":"Balance sheet: IRRBB and liquidity","es":"Balance: IRRBB y liquidez"},"question":{"en":"Would the standardised EVE outlier test and the NII sensitivity have flagged the position of the bank that failed in March 2023, read on its call reports, and how much does the answer hang on the deposit assumptions?","es":"¿Habría señalado el test de valores atípicos del EVE estandarizado y la sensibilidad del NII la posición del banco que quebró en marzo de 2023, leída en sus reportes, y cuánto depende la respuesta de los supuestos sobre depósitos?"},"sources":["fdic-bankfind","treasury-par-curve"],"source_details":{"fdic-bankfind":{"name":"FDIC BankFind Suite (failures, financials)","publisher":"Federal Deposit Insurance Corporation","landing":"https://api.fdic.gov/banks/docs","licence":"no licence sentence found; US agency (UNVERIFIED)","class":"mirror-allowed","attribution":"Federal Deposit Insurance Corporation, BankFind Suite"},"treasury-par-curve":{"name":"US Treasury daily par yield curve","publisher":"U.S. Department of the Treasury","landing":"https://home.treasury.gov/resource-center/data-chart-center/interest-rates/","licence":"no licence sentence found; 17 U.S.C. 105 (page statement UNVERIFIED)","class":"mirror-allowed","attribution":"U.S. Department of the Treasury, Daily Treasury Par Yield Curve Rates"}},"seed":42,"engine":{"pipeline":"0.12.000","riskvalidation":"0.8.0"},"default_variant":"vd-2022-q4","artifacts":[{"role":"models","variant_id":"models-svb-2021-2022","truth_status":"synthetic-calibrated","title":{"en":"Fitted models and tables, 2021 to 2022","es":"Modelos ajustados y tablas, 2021 a 2022"},"short_title":{"en":"Models","es":"Modelos"},"regime":{"en":"Call reports and Treasury curve read up to the date; behaviour synthetic, stated in the document.","es":"Reportes y curva del Tesoro leídos hasta la fecha; comportamiento sintético, declarado en el documento."},"path":"C14/models-svb-2021-2022.json","bytes":19810,"lane":"precompute","gate":{"lane":"precompute","pure_python":false,"wheels":["numpy","riskvalidation","scipy"],"trace_bytes":19810,"run_ms_budget":1500.0,"trace_bytes_budget":262144,"reasons":["not pure-python","runtime exceeds the 1500ms budget"]}},{"role":"variant","variant_id":"vd-2021-q4","truth_status":"synthetic-calibrated","title":{"en":"Valuation date 2021-12-31 (2021-Q4)","es":"Fecha de valoración 2021-12-31 (2021-Q4)"},"short_title":{"en":"2021-Q4","es":"2021-Q4"},"regime":{"en":"Call reports and Treasury curve read up to the date; behaviour synthetic, stated in the document.","es":"Reportes y curva del Tesoro leídos hasta la fecha; comportamiento sintético, declarado en el documento."},"models_ref":"C14/models-svb-2021-2022.json","path":"C14/vd-2021-q4.json","bytes":81183,"lane":"precompute","gate":{"lane":"precompute","pure_python":false,"wheels":["numpy","riskvalidation","scipy"],"trace_bytes":81183,"run_ms_budget":1500.0,"trace_bytes_budget":262144,"reasons":["not pure-python","runtime exceeds the 1500ms budget"]}},{"role":"variant","variant_id":"vd-2022-q2","truth_status":"synthetic-calibrated","title":{"en":"Valuation date 2022-06-30 (2022-Q2)","es":"Fecha de valoración 2022-06-30 (2022-Q2)"},"short_title":{"en":"2022-Q2","es":"2022-Q2"},"regime":{"en":"Call reports and Treasury curve read up to the date; behaviour synthetic, stated in the document.","es":"Reportes y curva del Tesoro leídos hasta la fecha; comportamiento sintético, declarado en el documento."},"models_ref":"C14/models-svb-2021-2022.json","path":"C14/vd-2022-q2.json","bytes":82283,"lane":"precompute","gate":{"lane":"precompute","pure_python":false,"wheels":["numpy","riskvalidation","scipy"],"trace_bytes":82283,"run_ms_budget":1500.0,"trace_bytes_budget":262144,"reasons":["not pure-python","runtime exceeds the 1500ms budget"]}},{"role":"variant","variant_id":"vd-2022-q4","truth_status":"synthetic-calibrated","title":{"en":"Valuation date 2022-12-31 (2022-Q4)","es":"Fecha de valoración 2022-12-31 (2022-Q4)"},"short_title":{"en":"2022-Q4","es":"2022-Q4"},"regime":{"en":"Call reports and Treasury curve read up to the date; behaviour synthetic, stated in the document.","es":"Reportes y curva del Tesoro leídos hasta la fecha; comportamiento sintético, declarado en el documento."},"models_ref":"C14/models-svb-2021-2022.json","path":"C14/vd-2022-q4.json","bytes":82420,"lane":"precompute","gate":{"lane":"precompute","pure_python":false,"wheels":["numpy","riskvalidation","scipy"],"trace_bytes":82420,"run_ms_budget":1500.0,"trace_bytes_budget":262144,"reasons":["not pure-python","runtime exceeds the 1500ms budget"]}}],"contract":{"fdic-bankfind":{"family":"balance_sheet","counts":{"input":113,"accepted":113,"rejected":0,"flagged":11,"excluded":0},"by_rule":{"rejected":{},"flagged":{"BS-NMD-CAPS":11},"excluded":{}},"ignored_columns":[],"examples":[{"kind":"flagged","row":79,"key":"2022-12-31","field":"core_share","value":"0.95","expected":"Core non-maturity deposits respect the caps of SRP31 Table 4; above them the engine applies the cap.","policy":"flag","reason":"core share 0.95 above the cap 0.9; average maturity of core 6 y above the cap 5 y; the engine applies the cap","rule":"BS-NMD-CAPS"},{"kind":"flagged","row":80,"key":"2022-12-31","field":"core_share","value":"0.95","expected":"Core non-maturity deposits respect the caps of SRP31 Table 4; above them the engine applies the cap.","policy":"flag","reason":"core share 0.95 above the cap 0.9; average maturity of core 6 y above the cap 5 y; the engine applies the cap","rule":"BS-NMD-CAPS"},{"kind":"flagged","row":81,"key":"2022-12-31","field":"core_share","value":"0.95","expected":"Core non-maturity deposits respect the caps of SRP31 Table 4; above them the engine applies the cap.","policy":"flag","reason":"core share 0.95 above the cap 0.9; average maturity of core 6 y above the cap 5 y; the engine applies the cap","rule":"BS-NMD-CAPS"},{"kind":"flagged","row":82,"key":"2022-12-31","field":"core_share","value":"0.6","expected":"Core non-maturity deposits respect the caps of SRP31 Table 4; above them the engine applies the cap.","policy":"flag","reason":"core share 0.6 above the cap 0.5; average maturity of core 5 y above the cap 4 y; the engine applies the cap","rule":"BS-NMD-CAPS"},{"kind":"flagged","row":83,"key":"2022-12-31","field":"core_share","value":"0.6","expected":"Core non-maturity deposits respect the caps of SRP31 Table 4; above them the engine applies the cap.","policy":"flag","reason":"core share 0.6 above the cap 0.5; average maturity of core 5 y above the cap 4 y; the engine applies the cap","rule":"BS-NMD-CAPS"}]},"treasury-par-curve":{"family":"curve","counts":{"input":13,"accepted":13,"rejected":0,"flagged":0,"excluded":0},"by_rule":{"rejected":{},"flagged":{},"excluded":{}},"ignored_columns":[],"examples":[]}},"expect":{"base_nii_over_reported_2022q4":[0.4,2.5],"deposit_beta_up_2022q4":[0.0,1.0],"eve_ratio_2024_behavioural_2022q4":[0.0,2.0],"eve_ratio_2024_contractual_2021q4":[0.2,3.0],"eve_ratio_2024_contractual_2022q4":[0.2,3.0]}}